{
 "$schema": "https://json-schema.org/draft/2020-12/schema",
 "$id": "https://awenweave.com/constitution/0.1/claim.schema.json",
 "title": "Claim (honiad)",
 "x-awen-rule-id": "SCH-CLAIM-001",
 "x-awen-status": "reconciled 2026-07-04 against awen-weave 0.2.0 (SCHEMA_VERSION v0.1)",
 "description": "An honiad asserts a value about an entity via a predicate (perthynas), with provenance and a confidence. This schema mirrors the claim-table contract the live awen-weave validator enforces (craidd.schema.validation.validate_claim + storage/ddl.py CHECK constraints, SCHEMA_VERSION v0.1). The canonical Welsh term for the predicate concept is perthynas, locked by Catrin Stephens 2026-05-19 (VOC-PERTHYNAS); the machine field name stays English (`predicate`) per the tutor's schema-identifiers-stay-English attestation. NB tier and source.kind are constitution/policy-layer classification attributes (see POL-TIERAB-001, SOV-003), NOT stored claim columns in v0.1 code — they are applied at classification/policy time, not carried on the claim row; see compatibility.md.",
 "type": "object",
 "required": [
  "subject_id",
  "predicate",
  "source_id",
  "recorded_by",
  "confidence"
 ],
 "additionalProperties": false,
 "properties": {
  "claim_id": {
   "type": "string",
   "minLength": 1,
   "description": "Stable claim id (PK). Instance-scoped; the code does not constrain its format. Absent on the pre-insert validation shape, present on stored rows."
  },
  "subject_id": {
   "type": "string",
   "minLength": 1,
   "description": "Entity id this claim is about (FK to entity.entity_id)."
  },
  "predicate": {
   "type": "string",
   "minLength": 1,
   "description": "The predicate/relationship (perthynas). FK to predicate.name; must be a registered predicate. Drawn from the controlled predicate set (awen-weave predicates.py); the Welsh concept term is perthynas (VOC-PERTHYNAS)."
  },
  "value_text": {
   "type": [
    "string",
    "null"
   ],
   "description": "Value column for value_type=text."
  },
  "value_int": {
   "type": [
    "integer",
    "null"
   ],
   "description": "Value column for value_type=int (DDL BIGINT)."
  },
  "value_real": {
   "type": [
    "number",
    "null"
   ],
   "description": "Value column for value_type=real (DDL DOUBLE)."
  },
  "value_date": {
   "type": [
    "string",
    "null"
   ],
   "format": "date",
   "description": "Precise date value for value_type=date (DDL DATE). Precision recorded via the date_precision qualifier."
  },
  "value_date_text": {
   "type": [
    "string",
    "null"
   ],
   "description": "Free-text companion for imprecise dates (value_type=date)."
  },
  "value_geom": {
   "type": [
    "string",
    "null"
   ],
   "description": "Geometry value for value_type=geom, carried as WKT (e.g. 'POINT(-3.886 52.741)'). Stored as GEOMETRY via the DuckDB spatial extension."
  },
  "value_cy": {
   "type": [
    "string",
    "null"
   ],
   "description": "Welsh value for value_type=bilingual (at least one of value_cy / value_en must be set)."
  },
  "value_en": {
   "type": [
    "string",
    "null"
   ],
   "description": "English value for value_type=bilingual (at least one of value_cy / value_en must be set)."
  },
  "value_entity_ref": {
   "type": [
    "string",
    "null"
   ],
   "description": "Entity id this claim points to, for value_type=entity_ref (FK to entity.entity_id)."
  },
  "qualifiers": {
   "$ref": "https://awenweave.com/constitution/0.1/claim.schema.json#/$defs/qualifiers",
   "description": "Claim-level metadata map (stored as claim.qualifiers_json). Vocabularies enforced at the schema/validation layer, not by DDL CHECK."
  },
  "source_id": {
   "type": "string",
   "minLength": 1,
   "description": "Provenance: FK to a source entity (entity_type=source). Source metadata — licence, organisation, url, citation — lives as predicates on that entity, not inline here."
  },
  "recorded_by": {
   "type": "string",
   "minLength": 1,
   "description": "Curator/actor identity that recorded the claim (typically an email)."
  },
  "recorded_at": {
   "type": "string",
   "format": "date-time",
   "description": "When the claim was recorded (DDL DEFAULT NOW())."
  },
  "confidence": {
   "type": "string",
   "enum": [
    "high",
    "medium",
    "low"
   ],
   "description": "Curator confidence. DDL NOT NULL CHECK (high/medium/low). Distinct from the binding qualifier (how the value was derived)."
  },
  "evidence_uri": {
   "type": [
    "string",
    "null"
   ],
   "description": "Optional pointer to evidence backing the claim."
  },
  "superseded_by": {
   "type": [
    "string",
    "null"
   ],
   "description": "claim_id of the claim that supersedes this one, if any (forward-additive; supersede, do not delete)."
  },
  "status": {
   "type": "string",
   "enum": [
    "active",
    "superseded",
    "disputed",
    "withdrawn"
   ],
   "default": "active",
   "description": "Claim lifecycle status. DDL NOT NULL DEFAULT 'active' CHECK."
  }
 },
 "$defs": {
  "qualifiers": {
   "type": "object",
   "description": "The 24 v0.1 qualifier keys (awen-weave qualifiers.py QUALIFIER_KEYS). Unknown keys are rejected (closed key set). Closed-domain values must be in their set; open-domain values (dialect, floor_scope) are not rejected. Three cross-qualifier rules are enforced below. The 5 projection keys (scenario/horizon/baseline/confidence_interval/uncertainty_basis) were added 0.1.6 (NWC-FEEDBACK-001) so a climate projection can render scenario, horizon, baseline and a statistical (not editorial) uncertainty. 0.1.7 adds `resolved_toid` (open-form OGL OS TOID) + `spatial_status` (CLOSED within/boundary-adjacent/outside) for spatial-membership provenance (confidence/provenance model — confirm-property + rung-1 footprint-snap). 0.1.8 adds `vertical_datum` (CLOSED ordnance-datum-newlyn/chart-datum/local-stage-datum/unstated; required on tide_level + water_level by awen-weave validation), `verification_method` += `sensor-measured`, and `geometry_basis` += `field-placed-witnessed`.",
   "additionalProperties": false,
   "properties": {
    "dialect": {
     "type": "string",
     "minLength": 1,
     "description": "OPEN domain — any ISO language code accepted. Known values: cy-GB-north (Dolgellau default), cy-GB-south, cy-GB-mid, cy-GB."
    },
    "name_type": {
     "type": "string",
     "enum": [
      "current_local",
      "listed_register",
      "historic",
      "vernacular"
     ],
     "description": "CLOSED domain. Required on every name_cy / name_en claim."
    },
    "floor_scope": {
     "type": "string",
     "minLength": 1,
     "description": "OPEN domain — free text accepted. Known values: whole, ground, first, upper, attic, basement. Used on tenancy and event claims."
    },
    "date_precision": {
     "type": "string",
     "enum": [
      "exact",
      "year",
      "decade",
      "century",
      "range"
     ],
     "description": "CLOSED domain. Used on claims carrying a value_date."
    },
    "verification_method": {
     "type": "string",
     "enum": [
      "on-site",
      "aerial",
      "local-knowledge",
      "documentary",
      "desk-derived",
      "sensor-measured"
     ],
     "description": "CLOSED domain (§10 item 7). How a verification decision was reached. `sensor-measured` (0.1.8, dispatch 381) = the value is a reading taken by a physical sensor, recorded as `binding=measured`; a commissioned device's witnessing reuses the existing field_session_id / co_signed_by / verified_at / evidence_uri. It does NOT cover an inferred output (a classifier result whose supporting evidence was discarded) — that class is an open constitutional question."
    },
    "temporal_status": {
     "type": "string",
     "enum": [
      "existing",
      "proposed",
      "historic",
      "removed"
     ],
     "description": "CLOSED domain (§10 item 7). Default 'existing'."
    },
    "geometry_basis": {
     "type": "string",
     "enum": [
      "os-open-uprn-original",
      "auto-snapped-to-toid",
      "curator-placed",
      "curator-confirmed-original",
      "field-placed-witnessed"
     ],
     "description": "CLOSED domain (§10 item 7). Optional; how a geometry value was arrived at. `curator-placed` = a curator placed the point at a desk (drag-to-place). `field-placed-witnessed` = a physical device was placed in the field and the placement was witnessed on site; record the witness and time in the claim's field_session_id / co_signed_by / verified_at / evidence_uri. Added 0.1.8 (Llys 26/09/2026, IDR-006-16338A) rather than widening curator-placed, so the witnessed case is findable by name."
    },
    "binding": {
     "type": "string",
     "enum": [
      "asserted",
      "measured",
      "curated",
      "derived",
      "federated"
     ],
     "description": "CLOSED domain (Phase 2.1 §10 item 8). How the claim's value was derived. No default — a stated binding is always explicit. 'federated' requires source-of-record (see cross-rule)."
    },
    "verified_at": {
     "type": "string",
     "minLength": 1,
     "description": "OPEN-form (§10 item 7). ISO-8601 date or datetime; validated by _validate_iso_date in validation.py."
    },
    "cache_snapshot_id": {
     "type": "string",
     "minLength": 1,
     "description": "OPEN-form (§10 item 7). Non-empty string."
    },
    "field_session_id": {
     "type": "string",
     "minLength": 1,
     "description": "OPEN-form (§10 item 7). Non-empty string; required when co_signed_by is present."
    },
    "co_signed_by": {
     "type": "string",
     "minLength": 1,
     "description": "OPEN-form (§10 item 7). Non-empty string. Requires field_session_id in the same qualifier set (co-sign needs a named session)."
    },
    "federated_from": {
     "type": "string",
     "minLength": 1,
     "description": "OPEN-form (Phase 2.1). Source instance id for a federated read; required when binding=federated."
    },
    "source_ran_at": {
     "type": "string",
     "minLength": 1,
     "description": "OPEN-form (Phase 2.1). The SOURCE's own run-UTC (ISO-8601), read from its manifest — verify-not-recall. Required when binding=federated."
    },
    "semantics_caveat": {
     "type": "string",
     "minLength": 1,
     "description": "OPEN-form (0.1.3). A stated limit on what this claim's value MEANS, so meaning travels with the datum and cannot be silently over-claimed downstream (provenance-with-semantics). Advisory cross-rule (SHOULD, not enforced by schema): SHOULD be present on binding ∈ {derived, federated} where a meaning-limit exists. Amendment: amendments/2026-07-11-SCH-CLAIM-001-semantics-caveat.md."
    },
    "travel_mode": {
     "type": "string",
     "enum": [
      "auto",
      "pedestrian",
      "bicycle"
     ],
     "description": "CLOSED domain. The travel profile a routing-derived claim was computed under. Required on reachability predicates (travel_time_to_nearest, network_distance_to_nearest, reachable_area): a duration or distance is meaningless without the mode it was computed for, and carrying mode as a qualifier rather than in the predicate name keeps one predicate per concept instead of one per concept-times-mode. `transit` is deliberately absent until GTFS feeds exist — an unavailable mode must be rejected, never silently served as driving."
    },
    "scenario": {
     "type": "string",
     "minLength": 1,
     "description": "OPEN-form (0.1.6). The emissions/socioeconomic pathway a projection was computed under, verbatim from its source. Standard anchor: IPCC RCP / SSP vocabulary (e.g. 'RCP8.5', 'SSP2-4.5'). A projected value is meaningless without it; requires horizon + baseline (cross-rule below). Absent on an observation (see uncertainty_basis=observed)."
    },
    "horizon": {
     "type": "string",
     "minLength": 1,
     "description": "OPEN-form (0.1.6). The future period a projection is FOR, as an ISO-8601 period (e.g. '2070/2099'). Paired with scenario + baseline."
    },
    "baseline": {
     "type": "string",
     "minLength": 1,
     "description": "OPEN-form (0.1.6). The reference period a projected change is measured AGAINST, as an ISO-8601 period (e.g. '1981/2010'). Paired with scenario + horizon."
    },
    "confidence_interval": {
     "type": "string",
     "minLength": 1,
     "description": "OPEN-form (0.1.6). The statistical spread of a projected/estimated value, verbatim (e.g. '10th-90th percentile', '±0.3 m'). Distinct from the claim's editorial `confidence` (high/medium/low) — this is the statistical range NWC-FEEDBACK-001 requires."
    },
    "uncertainty_basis": {
     "type": "string",
     "enum": [
      "ensemble",
      "single-model",
      "expert-judgement",
      "observed"
     ],
     "description": "CLOSED domain (0.1.6). How the value's uncertainty was established. Standard anchor: OGC UncertML / statistical convention. `observed` marks a measured (non-projected) reading — so scenario/horizon/baseline are then legitimately absent; the same key cleanly separates observation from projection without a second predicate (fork (c), Llys 07/08)."
    },
    "resolved_toid": {
     "type": "string",
     "minLength": 1,
     "description": "OPEN-form (0.1.7). The OGL OS TOID a property's UPRN/address resolves to (OS Open Linked Identifiers UPRN↔TOID for the desk path; curator address↔UPRN↔TOID for the gold path). An OGL identifier — verification-not-data: NEVER premium MasterMap geometry. First-class per Llys 11/08 so the resolved identity is a structured field, not caveat text. Amendment: amendments/2026-08-11-SCH-CLAIM-001-toid-spatial-status.md."
    },
    "spatial_status": {
     "type": "string",
     "enum": [
      "within",
      "boundary-adjacent",
      "outside"
     ],
     "description": "CLOSED domain (0.1.7). The result of a spatial-membership test of a property against an area boundary: `within` (clear of the boundary by a margin), `boundary-adjacent` (straddles / within the margin — membership NOT asserted in or out), `outside`. Written by the rung-1 footprint-snap (OS OpenMap Local, desk-derived). Paired with the editorial `confidence` (within→high, boundary-adjacent→low). Amendment: amendments/2026-08-11-SCH-CLAIM-001-toid-spatial-status.md."
    },
    "vertical_datum": {
     "type": "string",
     "enum": [
      "ordnance-datum-newlyn",
      "chart-datum",
      "local-stage-datum",
      "unstated"
     ],
     "description": "CLOSED domain (0.1.8). The vertical reference a height/level value is measured from. Declared from the publisher's own unit or statement, never inferred. `ordnance-datum-newlyn` = height above Ordnance Datum Newlyn (EPSG:5701; EA/NRW mAOD). `chart-datum` = height above the local Chart Datum of the nearest port (per port; EA mACD). `local-stage-datum` = height above the gauge's own zero (EA mASD). `unstated` = the publisher gives a level with no datum (EA bare `m`, 'metres with an unspecified datum', or `---`); recorded so, never guessed, and only where the publisher's unit says so. REQUIRED on the `tide_level` and `water_level` predicates — enforced by awen-weave's validation (validate_claim / craidd.validation_gate), not by this schema, which carries no per-predicate requirement (the travel_mode precedent). Amendment: amendments/2026-09-26-SCH-CLAIM-001-vertical-datum-sensor-measured.md."
    }
   },
   "dependentRequired": {
    "co_signed_by": [
     "field_session_id"
    ],
    "scenario": [
     "horizon",
     "baseline"
    ]
   },
   "allOf": [
    {
     "if": {
      "properties": {
       "binding": {
        "const": "federated"
       }
      },
      "required": [
       "binding"
      ]
     },
     "then": {
      "required": [
       "federated_from",
       "source_ran_at"
      ]
     }
    }
   ]
  }
 }
}
